{"_meta": {"api_version": "1", "contract_version": "1.14", "generated_at": "2026-07-14T04:14:48+00:00", "provenance": "fixtures", "data_tier": "real", "license": "City of Chicago Data Portal Terms of Use (data.cityofchicago.org); derived analyses by On Your Left!", "attribution": "On Your Left! \u2014 Chicago bike safety, on the record (https://github.com/jartinator/chicago-safe-streets-data)", "human_page": "https://jartinator.github.io/chicago-safe-streets-data/index.html", "methodology": "https://jartinator.github.io/chicago-safe-streets-data/methodology.html", "schema": "https://jartinator.github.io/chicago-safe-streets-data/api/v1/schemas/crash-slice.schema.json"}, "ward": "16", "ward_url": "https://jartinator.github.io/chicago-safe-streets-data/api/v1/wards/ward-16.json", "columns": ["crash_id", "date", "lat", "lng", "injury_severity", "dooring", "hit_and_run", "street"], "rows": [["FIXTURECRASH00119", "2023-10-18T15:11:00", 41.77383, -87.80381, "reported_not_evident", false, false, "5574 N RANDOM ST"], ["FIXTURECRASH00283", "2026-04-14T09:20:00", 41.77687, -87.83817, "non_incapacitating", false, true, "3956 S RANDOM ST"], ["FIXTURECRASH00535", "2025-01-12T11:23:00", 41.77594, -87.82603, "non_incapacitating", false, true, "2794 S RANDOM ST"], ["FIXTURECRASH00779", "2020-09-20T16:52:00", 41.76368, -87.79331, "incapacitating", false, true, "1377 S RANDOM ST"], ["FIXTURECRASH00972", "2022-01-20T05:18:00", 41.75898, -87.8071, "non_incapacitating", false, false, "5518 S RANDOM ST"], ["FIXTURECRASH00979", "2018-09-29T16:08:00", 41.75818, -87.83237, "non_incapacitating", false, false, "1851 E RANDOM ST"], ["FIXTURECRASH01053", "2018-01-07T05:25:00", 41.76413, -87.7936, "non_incapacitating", false, false, "601 N RANDOM ST"]], "count": 7, "note": "crash_id is a 16-hex-char prefix of the full crash_id (full ids and the full field set are in site/data/crashes_cyclist.geojson, linked via full_data_url); lat/lng are rounded to 5 decimal places. Dropped columns crash_type, lighting, and segment_id are available in the full GeoJSON.", "full_data_url": "https://jartinator.github.io/chicago-safe-streets-data/data/crashes_cyclist.geojson"}